{
  "schemaVersion": 1,
  "toolVersion": "0.1.0",
  "adapterVersion": "1.0.0",
  "nativeVersion": "2.1.280",
  "nativeSha256": "387a5c5dcdbb815085edf0baf79591f9d8894efe922bceaf3d75b1b08055229d",
  "OS": "darwin",
  "arch": "arm64",
  "recordedAt": "2026-10-11T22:00:49.556Z",
  "invocationMode": "explicit-command; bare + add-dir",
  "networkMode": "127.0.0.1 synthetic Messages endpoint; no OS egress confinement",
  "coverage": "native-verified",
  "recorded": true,
  "cases": [
    {
      "id": "argument-substitution",
      "title": "Intentional indexed and full argument substitution",
      "fixtureHash": "1e5c1064434b56b9c5f9e7f609c37232431a42b0e45a63503fd86c365873bbc3",
      "outcome": "pass",
      "measurementStatus": "complete",
      "contractStatus": "pass",
      "observedStages": [
        "body"
      ],
      "checks": [
        {
          "id": "body-text",
          "stage": "body",
          "sourceFile": "skill/argument-substitution/SKILL.md",
          "sourceSha256": "7379e8fc1af455faaff132579ef96ef37331ffb06d3c16cf8d372af5c4eb7349",
          "encoding": "UTF-8",
          "sourceRange": {
            "startByte": 186,
            "endByte": 235
          },
          "source": "\nAll: $ARGUMENTS\nFirst: $0\nSecond: $ARGUMENTS[1]\n",
          "expected": "\nAll: north south\nFirst: north\nSecond: south\n",
          "transmitted": "\nAll: north south\nFirst: north\nSecond: south\n",
          "mode": "exact-text",
          "normalization": "none",
          "expectedOccurrences": 1,
          "pass": true,
          "rawPass": true,
          "occurrences": 1,
          "diff": [
            {
              "kind": "equal",
              "text": "\nAll: north south\nFirst: north\nSecond: south\n"
            }
          ],
          "evidenceRef": {
            "requestOrdinal": 1,
            "messageIndex": 0,
            "blockIndex": 3
          }
        }
      ],
      "limits": {
        "inputBytes": 262144,
        "requestBytes": 8388608,
        "turns": 8,
        "timeoutMs": 30000
      },
      "evidence": [
        {
          "sequence": 1,
          "stage": "validate",
          "elapsedMs": 0
        },
        {
          "sequence": 2,
          "stage": "isolate",
          "elapsedMs": 1
        },
        {
          "sequence": 3,
          "stage": "start-endpoint",
          "elapsedMs": 18
        },
        {
          "sequence": 4,
          "stage": "start-native",
          "elapsedMs": 18
        },
        {
          "sequence": 5,
          "stage": "invoked",
          "elapsedMs": 18,
          "detail": "Explicit native /argument-substitution"
        },
        {
          "sequence": 6,
          "stage": "body-observed",
          "elapsedMs": 195,
          "requestOrdinal": 1
        },
        {
          "sequence": 7,
          "stage": "compared",
          "elapsedMs": 217
        },
        {
          "sequence": 8,
          "stage": "completed",
          "elapsedMs": 217
        },
        {
          "sequence": 9,
          "stage": "cleanup",
          "elapsedMs": 219
        }
      ],
      "evidenceRefs": [
        {
          "requestOrdinal": 1,
          "bytes": 2058
        }
      ],
      "isolation": {
        "uniqueConfig": true,
        "newSession": true,
        "homePreserved": true,
        "excludedCanaryAbsent": true,
        "onlyExpectedTools": true,
        "cleanup": true
      },
      "nativeExitCode": 0,
      "omissions": [
        "Reference Read was not requested or measured"
      ]
    },
    {
      "id": "crlf",
      "title": "CRLF with declared CRLF → LF normalization",
      "fixtureHash": "935d4651ad4e453f235a0d6b84d1f9e94bb0a1ab00f44872e0382f763f8d2e3c",
      "outcome": "pass",
      "measurementStatus": "complete",
      "contractStatus": "pass",
      "observedStages": [
        "body"
      ],
      "checks": [
        {
          "id": "body-text",
          "stage": "body",
          "sourceFile": "skill/crlf/SKILL.md",
          "sourceSha256": "fea4accf77f00367aefa0c092ce473d9ccc30c8a51eb0dcb1d7c57c5f8fdde73",
          "encoding": "UTF-8",
          "sourceRange": {
            "startByte": 129,
            "endByte": 156
          },
          "source": "\r\nFirst line\r\nSecond line\r\n",
          "expected": "\r\nFirst line\r\nSecond line\r\n",
          "transmitted": "\r\nFirst line\r\nSecond line\r\n",
          "mode": "exact-text",
          "normalization": "crlf-to-lf",
          "expectedOccurrences": 1,
          "pass": true,
          "rawPass": true,
          "occurrences": 1,
          "diff": [
            {
              "kind": "equal",
              "text": "\r\nFirst line\r\nSecond line\r\n"
            }
          ],
          "evidenceRef": {
            "requestOrdinal": 1,
            "messageIndex": 0,
            "blockIndex": 3
          }
        }
      ],
      "limits": {
        "inputBytes": 262144,
        "requestBytes": 8388608,
        "turns": 8,
        "timeoutMs": 30000
      },
      "evidence": [
        {
          "sequence": 1,
          "stage": "validate",
          "elapsedMs": 0
        },
        {
          "sequence": 2,
          "stage": "isolate",
          "elapsedMs": 0
        },
        {
          "sequence": 3,
          "stage": "start-endpoint",
          "elapsedMs": 16
        },
        {
          "sequence": 4,
          "stage": "start-native",
          "elapsedMs": 16
        },
        {
          "sequence": 5,
          "stage": "invoked",
          "elapsedMs": 16,
          "detail": "Explicit native /crlf"
        },
        {
          "sequence": 6,
          "stage": "body-observed",
          "elapsedMs": 194,
          "requestOrdinal": 1
        },
        {
          "sequence": 7,
          "stage": "compared",
          "elapsedMs": 216
        },
        {
          "sequence": 8,
          "stage": "completed",
          "elapsedMs": 216
        },
        {
          "sequence": 9,
          "stage": "cleanup",
          "elapsedMs": 218
        }
      ],
      "evidenceRefs": [
        {
          "requestOrdinal": 1,
          "bytes": 1917
        }
      ],
      "isolation": {
        "uniqueConfig": true,
        "newSession": true,
        "homePreserved": true,
        "excludedCanaryAbsent": true,
        "onlyExpectedTools": true,
        "cleanup": true
      },
      "nativeExitCode": 0,
      "omissions": [
        "Reference Read was not requested or measured"
      ]
    },
    {
      "id": "dollar-digit",
      "title": "Dollar digits with seven explicit arguments",
      "fixtureHash": "05d4d1e13f8652f616ba6a1afb6e68611696c015018b103f4304e9fb4cc76d5b",
      "outcome": "violation",
      "measurementStatus": "complete",
      "contractStatus": "violation",
      "observedStages": [
        "body"
      ],
      "checks": [
        {
          "id": "body-text",
          "stage": "body",
          "sourceFile": "skill/dollar-digit/SKILL.md",
          "sourceSha256": "f80dd34f59eb74b7bebd3f226131d32f29366183221c8880922508087516d25a",
          "encoding": "UTF-8",
          "sourceRange": {
            "startByte": 140,
            "endByte": 185
          },
          "source": "\nFormula =B5*(1+$B$6)\nSecond: $1\nSeventh: $6\n",
          "expected": "\nFormula =B5*(1+$B$6)\nSecond: $1\nSeventh: $6\n",
          "transmitted": "\nFormula =B5*(1+$Bseven)\nSecond: two\nSeventh: seven\n",
          "mode": "exact-text",
          "normalization": "none",
          "expectedOccurrences": 1,
          "pass": false,
          "rawPass": false,
          "occurrences": 0,
          "diff": [
            {
              "kind": "equal",
              "text": "\n"
            },
            {
              "kind": "removed",
              "text": "Formula =B5*(1+$B$6)\nSecond: $1\nSeventh: $6\n"
            },
            {
              "kind": "added",
              "text": "Formula =B5*(1+$Bseven)\nSecond: two\nSeventh: seven\n"
            }
          ],
          "evidenceRef": {
            "requestOrdinal": 1,
            "messageIndex": 0,
            "blockIndex": 3
          }
        }
      ],
      "limits": {
        "inputBytes": 262144,
        "requestBytes": 8388608,
        "turns": 8,
        "timeoutMs": 30000
      },
      "evidence": [
        {
          "sequence": 1,
          "stage": "validate",
          "elapsedMs": 0
        },
        {
          "sequence": 2,
          "stage": "isolate",
          "elapsedMs": 0
        },
        {
          "sequence": 3,
          "stage": "start-endpoint",
          "elapsedMs": 17
        },
        {
          "sequence": 4,
          "stage": "start-native",
          "elapsedMs": 17
        },
        {
          "sequence": 5,
          "stage": "invoked",
          "elapsedMs": 17,
          "detail": "Explicit native /dollar-digit"
        },
        {
          "sequence": 6,
          "stage": "body-observed",
          "elapsedMs": 193,
          "requestOrdinal": 1
        },
        {
          "sequence": 7,
          "stage": "compared",
          "elapsedMs": 213
        },
        {
          "sequence": 8,
          "stage": "completed",
          "elapsedMs": 213
        },
        {
          "sequence": 9,
          "stage": "cleanup",
          "elapsedMs": 215
        }
      ],
      "evidenceRefs": [
        {
          "requestOrdinal": 1,
          "bytes": 2042
        }
      ],
      "isolation": {
        "uniqueConfig": true,
        "newSession": true,
        "homePreserved": true,
        "excludedCanaryAbsent": true,
        "onlyExpectedTools": true,
        "cleanup": true
      },
      "nativeExitCode": 0,
      "omissions": [
        "Reference Read was not requested or measured"
      ]
    },
    {
      "id": "escaped-dollar",
      "title": "Escaped literal formula and awk placeholder",